{
  "schemaVersion": 1,
  "barIntervalMinutes": 5,
  "updatedAt": "2026-07-25T10:47:49.823Z",
  "pairs": {
    "SUI_USDC": {
      "live": {
        "firstCoveredBucketStart": "2026-06-26T18:30:00.000Z",
        "lastQueuedBucketStart": "2026-07-25T05:00:00.000Z",
        "lastCoveredBucketStart": "2026-07-25T05:00:00.000Z",
        "lastCoveredCheckpoint": "302679756"
      },
      "backfill": {
        "status": "complete",
        "oldestCoveredBucketStart": "2026-06-26T18:30:00.000Z",
        "oldestCoveredCheckpoint": "291573977",
        "cursor": null,
        "stoppedReason": "checkpoint_range_range_before_retained_data"
      },
      "missingBuckets": []
    },
    "DEEP_USDC": {
      "live": {
        "firstCoveredBucketStart": "2026-06-26T13:35:00.000Z",
        "lastQueuedBucketStart": "2026-07-25T05:00:00.000Z",
        "lastCoveredBucketStart": "2026-07-25T05:00:00.000Z",
        "lastCoveredCheckpoint": "302679756"
      },
      "backfill": {
        "status": "complete",
        "oldestCoveredBucketStart": "2026-06-26T13:35:00.000Z",
        "oldestCoveredCheckpoint": "291494355",
        "cursor": null,
        "stoppedReason": "checkpoint_range_range_before_retained_data"
      },
      "missingBuckets": []
    },
    "WAL_USDC": {
      "live": {
        "firstCoveredBucketStart": "2026-06-25T21:30:00.000Z",
        "lastQueuedBucketStart": "2026-07-25T05:00:00.000Z",
        "lastCoveredBucketStart": "2026-07-25T05:00:00.000Z",
        "lastCoveredCheckpoint": "302679756"
      },
      "backfill": {
        "status": "complete",
        "oldestCoveredBucketStart": "2026-06-25T21:30:00.000Z",
        "oldestCoveredCheckpoint": "291239514",
        "cursor": null,
        "stoppedReason": "checkpoint_range_range_before_retained_data"
      },
      "missingBuckets": []
    },
    "NS_USDC": {
      "live": {
        "firstCoveredBucketStart": "2026-06-16T08:00:00.000Z",
        "lastQueuedBucketStart": "2026-07-25T05:00:00.000Z",
        "lastCoveredBucketStart": "2026-07-25T05:00:00.000Z",
        "lastCoveredCheckpoint": "302679756"
      },
      "backfill": {
        "status": "complete",
        "oldestCoveredBucketStart": "2026-06-16T08:00:00.000Z",
        "oldestCoveredCheckpoint": "290275812",
        "cursor": null,
        "stoppedReason": "checkpoint_range_range_before_retained_data"
      },
      "missingBuckets": []
    },
    "USDSUI_USDC": {
      "live": {
        "firstCoveredBucketStart": "2026-06-16T05:05:00.000Z",
        "lastQueuedBucketStart": "2026-07-25T05:00:00.000Z",
        "lastCoveredBucketStart": "2026-07-25T05:00:00.000Z",
        "lastCoveredCheckpoint": "302679756"
      },
      "backfill": {
        "status": "complete",
        "oldestCoveredBucketStart": "2026-06-16T05:05:00.000Z",
        "oldestCoveredCheckpoint": "290221772",
        "cursor": null,
        "stoppedReason": "checkpoint_range_range_before_retained_data"
      },
      "missingBuckets": []
    }
  }
}
